commit	score	score_avg	round	status	description
baseline	51	62/52/42/48	baseline	Round 1 baseline image
round-02	60.5	65/72/55/50	round-02	KEEP	prompt_v2_weathered_metal_desaturated_neon_low_angle
round-03	52.25	58/61/48/42	round-03	DISCARD	same_prompt_regression_ernie_non_determinism
round-04	51.25	50/62/48/45	round-04	DISCARD	extreme_closeup_worms_eye_industrial_materials
2443280	0	0/0/0/0	keep	R1 no strategy
1243f11	59.5	62/68/58/50	keep	R2 no strategy
